{
  "$schema": "http://json-schema.org/draft-07/schema#",
  "$id": "schema.llm-request.v1",
  "title": "LLM Request",
  "type": "object",
  "required": ["schemaVersion", "requestId", "modelProfileId", "mode", "messages", "parameters"],
  "properties": {
    "schemaVersion": { "const": "1.0" },
    "requestId": { "type": "string", "pattern": "^llmreq_[A-Za-z0-9_-]+$" },
    "modelProfileId": { "type": "string" },
    "mode": { "type": "string", "enum": ["streaming", "non-streaming"] },
    "messages": {
      "type": "array",
      "minItems": 1,
      "items": {
        "type": "object",
        "required": ["role", "content"],
        "properties": {
          "role": {
            "type": "string",
            "enum": ["system", "developer", "user", "assistant", "tool"]
          },
          "content": { "type": "string" }
        },
        "additionalProperties": true
      }
    },
    "parameters": {
      "type": "object",
      "properties": {
        "temperature": { "type": "number", "minimum": 0 },
        "maxTokens": { "type": "integer", "minimum": 1 },
        "topP": { "type": "number", "minimum": 0, "maximum": 1 }
      },
      "additionalProperties": true
    },
    "responseFormat": { "type": "object" }
  },
  "additionalProperties": true
}
