{
  "schemaVersion": "1.0",
  "requestId": "llmreq_01",
  "modelProfileId": "model_default",
  "mode": "non-streaming",
  "messages": [
    {
      "role": "system",
      "content": "system prompt"
    },
    {
      "role": "user",
      "content": "user prompt"
    }
  ],
  "parameters": {
    "temperature": 0.7,
    "maxTokens": 4096,
    "topP": 1
  },
  "responseFormat": {
    "type": "json_schema",
    "schemaId": "schema.agent.reviewer.output.v1"
  }
}
